MTHFR C677T genetic polymorphism in combination with serum vitamin B2, B12 and aberrant DNA methylation of P16 and P53 genes in esophageal squamous cell carcinoma and esophageal precancerous lesions: a case-control study.
The study aimed to explore the associations between the interactions of serum vitamin B2 or B12 levels, aberrant DNA methylation of p16 or p53 and MTHFR C677T polymorphism and the risks of esophageal squamous cell carcinoma (ESCC) and esophageal precancerous lesion (EPL).
200 ESCC cases, 200 EPL cases and 200 normal controls were matched by age (± 2 years) and gender.
Serum vitamin B2 and B12 levels, MTHFR C677T genetic polymorphisms and the methylation status of genes were assessed.
Chi square test, one-way analysis of variance and binary logistic regression were performed.
The lowest quartile of both serum vitamin B2 and B12 with TT genotype showed significant increased EPL risk (OR = 4.91, 95% CI 1.31-18.35; OR = 6.88, 95% CI 1.10-42.80).	4,115,119.4,145,149.2,100,103.1,5,20.1,29,42.1,43,45.1,50,53.1,59,70	1,4.2,4.1,5.2,5.1,8.2,8.1,6.2,7.1,3.2,3
The highest quartile of both serum vitamin B2 and B12 with CC genotype showed significant decreased ESCC risk (OR = 0.16, 95% CI 0.04-0.60; OR = 0.10, 95% CI 0.02-0.46).	4,117,121.4,146,150.2,101,105.1,5,21.1,30,43.1,44,46.1,51,54.1,60,71	1,4.2,4.1,5.2,5.1,8.2,8.1,6.2,7.1,3.2,3
The ORs of p16 methylation for genotype CT and TT were 1.98 (95% CI 1.01-3.89) and 17.79 (95% CI 2.26-140.22) in EPL, 4.86 (95% CI 2.48-9.50) and 20.40 (95% CI 2.53-164.81) in ESCC, respectively.	4,56,60.4,84,89.4,119,123.4,147,152.2,114,117.2,177,181.1,12,27.1,32,40.1,41,43.1,48,50	1,7.2,7.3,7.4,7.1,8.2,8.3,8.4,8.1,9.2,10.3,9.4,10.1,5.2,5.3,6.4,6
Similarly, p53 methylation with genotype TT was associated with increased EPL and ESCC risks (OR = 13.28, 95% CI 1.67-105.70; OR = 15.24, 95% CI 1.90-122.62).	4,100,105.4,132,137.1,12,27.1,33,44.2,75,78.2,83,87	1,3.2,3.1,4.2,4.1,5.2,6
The MTHFR C677T genotype and serum vitamin B2 or B12 levels may interact in ways which associated with the EPL and ESCC risks.
The gene-gene interaction suggested that aberrant DNA methyaltion of either p16 or p53 combined with T alleles of MTHFR was associated with increased risks of both EPL and ESCC.
